{
  "task_name": "platform.integration.consume.v1",
  "task_id": "aaaaaaaa-aaaa-4aaa-8aaa-aaaaaaaaaaaa",
  "issued_at": "2026-08-13T08:00:01Z",
  "event": {
    "event_id": "ffffffff-ffff-4fff-8fff-ffffffffffff",
    "event_type": "agent.release.published",
    "schema_version": 1,
    "workspace_id": "11111111-1111-4111-8111-111111111111",
    "aggregate_id": "55555555-5555-4555-8555-555555555555",
    "aggregate_version": 1,
    "occurred_at": "2026-08-13T08:00:00Z",
    "trace_id": "0123456789abcdef0123456789abcdef",
    "traceparent": "00-0123456789abcdef0123456789abcdef-0123456789abcdef-01",
    "actor_id": "22222222-2222-4222-8222-222222222222",
    "user_id": "22222222-2222-4222-8222-222222222222",
    "request_id": "33333333-3333-4333-8333-333333333333",
    "payload": { "release_version": 1 }
  },
  "schema_version": 1,
  "signature": "aaaaaaaaaaaaaaaaaaaaaaaaaaaaaaaaaaaaaaaaaaaaaaaaaaaaaaaaaaaaaaaa"
}
